<type name="user" xmlns="http://nwillc.github.io/scotty" xmlns:xsi="http://www.w3.org/2001/XMLSchema-instance"
      xsi:schemaLocation="http://nwillc.github.io/scotty http://nwillc.github.io/scotty/database.xsd">

    <attribute name="username" value="guest"/>
    <attribute name="password" value="guestpw"/>

    <instance>
        <attribute name="env" value="prod"/>
        <instance>
            <attribute name="level" value="admin"/>
            <attribute name="username" value="admin"/>
            <attribute name="password" value="sekretz"/>
        </instance>
    </instance>
    <instance>
        <attribute name="env" value="qa"/>
        <instance>
            <attribute name="level" value="admin"/>
            <attribute name="username" value="qa"/>
            <attribute name="password" value="qapw"/>
        </instance>
    </instance>
</type>
